{
  "apps_bundle_decrypted": true,
  "bundle_inventory_rerun_authorized": false,
  "checks": {
    "all_frozen_inputs_match": true,
    "candidate_and_scientific_claims_remain_unmeasured": true,
    "expected_aggregate_matches": true,
    "five_freeze_tests_pass": true,
    "freeze_schema_is_closed": true,
    "member_count_total_and_manifest_recompute": true,
    "offline_provisioning_and_inventory_passed": true,
    "plaintext_extraction_task_model_gpu_boundaries_closed": true,
    "records_are_sorted_and_hash_only": true,
    "rerun_model_and_confirmatory_gates_closed": true,
    "returned_artifact_bytes_and_hashes_match": true,
    "revision_matches_both_artifacts": true,
    "validation_matches_closed_schema_fields": true
  },
  "confirmatory_claim_authorized": false,
  "freeze_config_sha256": "61245eef67787afa4d1d88baf02756cafe6a2dd05216749ef424faffcb7bb7bb",
  "gpu_used": false,
  "hashed_member_manifest_sha256": "5638593200548a0936fb7f5ea1b801158616278476c55640933ff0678fa95a81",
  "inventory_sha256": "9f6d8c9f2699c1c217b98568b71fb17bee943d7bb4e36eff6326365f2f9e1cea",
  "member_count": 96,
  "model_loaded": false,
  "model_run_authorized": false,
  "next_gate": "design_in_memory_static_api_inventory_protocol",
  "passed": true,
  "protected_plaintext_persisted": false,
  "provisioning_sha256": "69a94974cf6122f4b72f1a72f4f68b43e6a2d67dda51cf6c318f634a9a7e483b",
  "remote_project_revision": "8260a8c00e97604a8489bdbedc4958b1fb6eeac1",
  "run_kind": "proper_v2_3_appworld_apps_bundle_inventory_result_freeze",
  "schema_version": 1,
  "scientific_stage_passed": false,
  "source_extracted": false,
  "static_api_protocol_design_authorized": true,
  "task_or_api_data_read": false,
  "total_uncompressed_bytes": 1017074
}
